{
  "$schema": "../bridge.config.schema.json",
  "commands": {
    "feishu": {
      "linux": [
        "$HOME/.local/bin/feishu",
        "/usr/local/bin/feishu",
        "/usr/bin/feishu",
        "feishu",
        "lark-cli"
      ]
    }
  },
  "maxTimeoutMs": 120000,
  "maxOutputBytes": 1048576,
  "allowCwd": false
}
