{
  "$schema": "../bridge.config.schema.json",
  "commands": {
    "feishu": {
      "win32": [
        "%APPDATA%\\npm\\feishu.cmd",
        "%APPDATA%\\npm\\feishu",
        "feishu.cmd",
        "feishu",
        "lark-cli.cmd",
        "lark-cli"
      ]
    }
  },
  "maxTimeoutMs": 120000,
  "maxOutputBytes": 1048576,
  "allowCwd": false
}
